{
  "$schema": "./registry.schema.json",
  "version": 1,
  "marketplaceSemantics": {
    "skillBoundary": "portable-artifact-contract",
    "executionModel": {
      "portableSkillExecution": "A skill can be run by an agent from its own cwd as instructions plus readable and writable files, manifests, metadata, and generated artifacts.",
      "clashManagedExecution": "Clash can optionally host the same workflow as managed actions that register assets, fill metadata, preserve provenance, gate review, and apply canvas/timeline projections with CAS.",
      "hardBoundary": "The skill owns the workflow and artifact contract; Clash owns collaboration and project-state management. A missing Clash system capability must not prevent portable skill execution."
    },
    "hostCapabilityContract": "Skills depend on named host capability contracts, not Clash private storage or UI internals. Clash is one host implementation that provides collaboration, permissioning, asset registry, metadata fill, provenance, review gates, and CAS apply.",
    "artifactContract": {
      "publicInterfaces": [
        "action",
        "metadata-fill",
        "asset",
        "analysis-metadata",
        "view-projection",
        "timeline-cas-apply",
        "schema"
      ],
      "skillOwnedWorkspace": "The agent owns its cwd as a draft workspace and may read/write declared project files, actions, assets, metadata, manifests, schemas, and projections there before explicit apply.",
      "hostOwnedInternals": [
        "snapshot.bin",
        "project.sqlite",
        "loro-crdt-doc",
        "canvas-private-node-state",
        "runtime-secrets"
      ],
      "forbiddenDependencyPolicy": "Portable skills must not depend on snapshot.bin, SQLite rows, Loro documents, canvas private node state, runtime secrets, or any other Clash-private storage surface; managed Clash execution must expose those changes through public action, metadata, asset, and CAS projection contracts."
    },
    "systemCapabilityMeaning": "requiredSystemCapabilities is a compatibility field for Clash-native automation bindings needed for fully managed execution. These capabilities are not required to run a skill as a portable file/artifact workflow outside Clash.",
    "statusPolicy": {
      "ready": "ready means the skill has a runnable local CLI/action contract with contract tests proving its declared production artifacts, metadata, assets, or view projections.",
      "blockedBySystemGap": "blocked-by-system-gap skills must list systemGaps with a capability, concrete missing behavior, and unblockSignal for Clash-managed execution."
    },
    "clashRole": [
      "collaboration-management",
      "asset-registry",
      "metadata-fill",
      "provenance",
      "review-gates",
      "timeline-cas-apply",
      "canvas-timeline-projection"
    ]
  },
  "skills": [
    {
      "id": "clash.video.agentic-video-architecture",
      "name": "agentic-video-architecture",
      "title": "Agentic Video Architecture",
      "description": "Plan Clash video work as agent-first pipelines with manifests, stage gates, file projections, CAS apply, media lineage, and black-box QA.",
      "kind": "architecture",
      "source": "first-party",
      "path": "skills/video-production/agentic-video-architecture",
      "tags": ["architecture", "video", "agent-first", "pipeline", "qa"],
      "inputs": ["creative brief", "reference video", "project folder"],
      "outputs": [
        "pipeline manifest",
        "stage outputs",
        "system gap list",
        "QA checklist"
      ],
      "requiredSystemCapabilities": [
        "media.asset-registry",
        "media.analysis-store",
        "timeline.cas-projection",
        "render.export-validation",
        "legal.oss-license-ledger"
      ],
      "researchSources": ["OpenMontage", "HyperFrames", "Montage AI"],
      "status": "blocked-by-system-gap",
      "systemGaps": [
        {
          "capability": "timeline.cas-projection",
          "gap": "Timeline projection files and stale-write checks exist, but not every host/UI timeline write path is proven to use pull/edit/apply CAS.",
          "unblockSignal": "Every timeline-modifying CLI and host UI path uses the shared CAS apply contract with stale rejection tests."
        },
        {
          "capability": "render.export-validation",
          "gap": "Selected preview/export validation exists, but full video export receipts across MG, captions, MV, talking-head, and TVC workflows are incomplete.",
          "unblockSignal": "Rendered outputs carry codec, duration, fps, dimension, audio, caption, visual QA, and rights receipts across all production categories."
        }
      ]
    },
    {
      "id": "clash.video.agentic-video-creator",
      "name": "agentic-video-creator",
      "title": "Agentic Video Creator",
      "description": "Autonomously turn a creative brief into a Clash production run: organize one or more draft Canvases by creative context or sequence, keep storyboard/A-roll/B-roll coupled in visible Group paths, request only high-leverage human decisions, and assemble selected assets in a master Timeline.",
      "kind": "detail",
      "source": "first-party",
      "path": "skills/video-production/agentic-video-creator",
      "tags": [
        "agent-creator",
        "video",
        "multi-canvas",
        "human-in-the-loop",
        "timeline"
      ],
      "inputs": ["creative brief", "reference assets", "project constraints"],
      "outputs": [
        "draft Canvas generation paths",
        "candidate and selects records",
        "master Timeline projection",
        "creative and technical QA"
      ],
      "requiredSystemCapabilities": [
        "media.asset-registry",
        "timeline.cas-projection",
        "render.export-validation"
      ],
      "status": "blocked-by-system-gap",
      "systemGaps": [
        {
          "capability": "media.asset-registry",
          "gap": "Project assets and multi-Canvas state exist, but the public CLI cannot yet create a same-revision asset placement on another Canvas for cross-Canvas reference-driven generation.",
          "unblockSignal": "A public, tested CLI command adds an existing immutable Project asset revision to another Canvas without duplicating bytes and makes it available as a local generation reference."
        },
        {
          "capability": "render.export-validation",
          "gap": "The skill can produce and apply a master Timeline, but standalone Timeline render and validation are not uniformly available across every media, caption, graphics, and audio combination.",
          "unblockSignal": "Standalone Timeline rendering emits an immutable asset plus codec, dimensions, duration, audio, caption, and visual validation receipts for the supported production profiles."
        }
      ]
    },
    {
      "id": "clash.media.asset-metadata-architecture",
      "name": "asset-metadata-architecture",
      "title": "Asset Metadata Architecture",
      "description": "Design local/agent-first media assets, analysis metadata, immutable references, copy-on-write edits, rights metadata, and canvas projection safety.",
      "kind": "architecture",
      "source": "first-party",
      "path": "skills/video-production/asset-metadata-architecture",
      "tags": [
        "architecture",
        "assets",
        "metadata",
        "analysis",
        "copy-on-write"
      ],
      "inputs": [
        "project asset folder",
        "generated media",
        "reference media",
        "analysis files"
      ],
      "outputs": [
        "asset manifest",
        "analysis metadata",
        "lineage policy",
        "permission model"
      ],
      "requiredSystemCapabilities": [
        "media.asset-registry",
        "media.analysis-store",
        "media.copy-on-write",
        "media.rights-ledger",
        "timeline.cas-projection",
        "legal.oss-license-ledger"
      ],
      "researchSources": [
        "CutScript",
        "Montage AI",
        "Awesome Multi-Image Generation"
      ],
      "status": "blocked-by-system-gap",
      "systemGaps": [
        {
          "capability": "media.asset-registry",
          "gap": "Agent-readable asset manifests and projection metadata exist, but durable project DB rows, restore semantics, and canvas node mappings are not complete.",
          "unblockSignal": "A managed asset registry persists and restores assets with stable node mappings, path ownership checks, and black-box project recovery tests."
        },
        {
          "capability": "media.copy-on-write",
          "gap": "Derived overlay and reference lock contracts exist, but immutable downstream-reference enforcement is not yet universal across all asset edits.",
          "unblockSignal": "Every edit to a referenced asset either rejects or creates a derived copy with lineage, rights inheritance, and regression tests."
        },
        {
          "capability": "media.rights-ledger",
          "gap": "Rights ledger projections exist for reference workflows, but durable rights storage, attribution export, and legal review state are incomplete.",
          "unblockSignal": "Reference, generated, and derived assets carry durable rights ledger records through export receipts and review gates."
        }
      ]
    },
    {
      "id": "clash.video.motion-graphics-overlays",
      "name": "motion-graphics-overlays",
      "title": "Motion Graphics Overlays",
      "description": "Design kinetic typography, lower-thirds, character motion, data callouts, and branded overlays as editable Remotion TSX in a Canvas remotion-component, then deliver them through a live Timeline reference and Timeline render.",
      "kind": "detail",
      "source": "first-party",
      "path": "skills/video-production/motion-graphics-overlays",
      "tags": [
        "motion-graphics",
        "mg",
        "captions",
        "overlay",
        "remotion",